{
  "schema_version": "2.0",
  "is_illustrative": false,
  "redirect_from": [],
  "disclosure": {
    "commercial_relationship": "none"
  },
  "id": "tool_zotero",
  "slug": "zotero",
  "name": "Zotero",
  "official_name": "Zotero",
  "official_url": "https://www.zotero.org/",
  "developer_or_publisher": "Digital Scholar (nonprofit)",
  "summary": "A free, open-source reference manager that collects sources and creates citations.",
  "description": "Zotero is a free, open-source reference manager — a personal research assistant that helps you collect, organise, annotate, cite and share research. It can detect sources as you browse the web and save them to your library, and it works inside Word, LibreOffice and Google Docs to insert citations and build a bibliography. The software is free; online storage for synced files includes a free allowance, with paid storage plans for more space.",
  "category_ids": [
    "research",
    "education"
  ],
  "task_ids": [
    "task_manage_references",
    "task_find_scholarly_sources"
  ],
  "audience_ids": [
    "student",
    "researcher",
    "educator",
    "professional"
  ],
  "skill_level": "beginner",
  "pricing": {
    "model": "freemium",
    "verification_status": "verified",
    "source_ids": [
      "src_zotero_home",
      "src_zotero_storage"
    ],
    "checked_at": "2026-10-21",
    "free_tier_details": "The software is free. File storage includes 300 MB free.",
    "paid_plan_summary": "Extra storage is billed annually: 2 GB, 6 GB or Unlimited. Separate plans exist for labs and institutions.",
    "price_points": [
      {
        "plan": "Storage 2 GB",
        "amount": 20,
        "currency": "USD",
        "period": "year",
        "source_id": "src_zotero_storage",
        "checked_at": "2026-10-21"
      },
      {
        "plan": "Storage 6 GB",
        "amount": 60,
        "currency": "USD",
        "period": "year",
        "source_id": "src_zotero_storage",
        "checked_at": "2026-10-21"
      },
      {
        "plan": "Storage Unlimited",
        "amount": 120,
        "currency": "USD",
        "period": "year",
        "source_id": "src_zotero_storage",
        "checked_at": "2026-10-21"
      }
    ]
  },
  "platforms": {
    "values": [
      "macos",
      "windows",
      "linux",
      "ios",
      "android"
    ],
    "verification_status": "verified",
    "source_ids": [
      "src_zotero_home"
    ]
  },
  "deployment": [
    "desktop",
    "mobile"
  ],
  "ai_involvement": "unknown",
  "availability_status": "active",
  "account_required": "unknown",
  "open_source": {
    "is_open_source": true,
    "repository_url": "https://github.com/zotero",
    "source_ids": [
      "src_zotero_home"
    ]
  },
  "key_capabilities": [
    {
      "text": "Collect, organise, annotate, cite and share research.",
      "kind": "fact",
      "source_ids": [
        "src_zotero_home"
      ]
    },
    {
      "text": "Detects research as you browse the web so you can save it to your library.",
      "kind": "fact",
      "source_ids": [
        "src_zotero_home"
      ]
    },
    {
      "text": "Inserts citations and bibliographies directly inside Word, LibreOffice and Google Docs.",
      "kind": "fact",
      "source_ids": [
        "src_zotero_home"
      ]
    }
  ],
  "limitations": [
    {
      "text": "Free file storage is limited to 300 MB; more requires a paid storage plan.",
      "kind": "fact",
      "source_ids": [
        "src_zotero_storage"
      ]
    },
    {
      "text": "Citations are only as accurate as the saved metadata; always check each reference against the original source.",
      "kind": "editorial",
      "source_ids": []
    }
  ],
  "best_for": [
    "Students writing essays, projects or theses with citations",
    "Anyone collecting web and academic sources in one place"
  ],
  "not_ideal_for": [
    "Storing large collections of PDFs online without paying for extra storage"
  ],
  "learning_curve": "gentle",
  "getting_started": [
    "Install Zotero for your computer from the official site.",
    "Follow the official Quick Start Guide to add your first sources.",
    "Install the word-processor plugin and insert your first citation."
  ],
  "resource_ids": [
    "res_zotero_documentation"
  ],
  "alternative_tool_ids": [],
  "comparison_ids": [],
  "playbook_ids": [
    "pb_research_topic_cited_summary"
  ],
  "search_aliases": [
    "reference manager",
    "citation manager",
    "bibliography",
    "citations",
    "cite sources",
    "referencing",
    "mendeley alternative"
  ],
  "sources": [
    {
      "id": "src_zotero_home",
      "type": "official_site",
      "url": "https://www.zotero.org/",
      "title": "Zotero home page",
      "publisher": "Digital Scholar",
      "checked_at": "2026-10-21",
      "supports": [
        "identity",
        "capabilities",
        "platforms",
        "pricing",
        "licence"
      ],
      "quote": "Zotero is a free, easy-to-use tool to help you collect, organize, annotate, cite, and share research."
    },
    {
      "id": "src_zotero_storage",
      "type": "official_pricing",
      "url": "https://www.zotero.org/storage",
      "title": "Zotero Storage",
      "publisher": "Digital Scholar",
      "checked_at": "2026-10-21",
      "supports": [
        "pricing",
        "free_tier"
      ]
    }
  ],
  "editorial": {
    "status": "published",
    "author": "V2 research pass (AI-assisted, Claude)",
    "reviewer": "Product owner — blanket MVP approval (D-044)",
    "created_at": "2026-10-21",
    "updated_at": "2026-10-21",
    "published_at": "2026-10-21",
    "last_verified_at": "2026-10-21",
    "review_interval_days": 90,
    "next_review_at": "2027-01-19",
    "confidence": "high",
    "solo_approval": true,
    "change_summary": "Researched from official sources 2026-10-21; published under owner's blanket MVP approval (D-044). Domain-expert review pending.",
    "public_corrections": [],
    "internal_notes": ""
  }
}